No. Time Source Destination Protocol Length Info
3 0.354397 172.27.129.248 58.220.106.117 ICMP 1877/21767 Echo (ping) request  id=0x0001  seq=1877/21767  ttl=64 (reply in 4)
4 0.399147 58.220.106.117 172.27.129.248 ICMP 74 Echo (ping) reply    id=0x0001  seq=1877/21767  ttl=248 (request in 3)
5 0.402146 172.27.129.248 202.108.23.113 TCP 74 26772  >  80 [PSH  ACK] Seq=1 Ack=1 Win=515 Len=20
6 0.492873 202.108.23.113 172.27.129.248 TCP 60 80  >  26772 [ACK] Seq=1 Ack=21 Win=496 Len=0
7 0.492874 202.108.23.113 172.27.129.248 TCP 76 80  >  26772 [PSH  ACK] Seq=1 Ack=21 Win=496 Len=22
8 0.532863 172.27.129.248 202.108.23.113 TCP 54 26772  >  80 [ACK] Seq=21 Ack=23 Win=515 Len=0
13 0.785915 172.27.129.248 111.206.223.168 TLSv1.2 85 Encrypted Alert
14 0.785957 172.27.129.248 111.206.223.168 TCP 54 26787  >  443 [RST  ACK] Seq=32 Ack=1 Win=0 Len=0
15 0.786232 172.27.129.248 111.206.223.168 TCP 66 26841  >  443 [SYN] Seq=0 Win=64240 Len=0 MSS=1460 WS=256 SACK_PERM=1
16 0.836788 111.206.223.168 172.27.129.248 TCP 66 443  >  26841 [SYN  ACK] Seq=0 Ack=1 Win=8192 Len=0 MSS=1452 WS=32 SACK_PERM=1
17 0.836870 172.27.129.248 111.206.223.168 TCP 54 26841  >  443 [ACK] Seq=1 Ack=1 Win=132096 Len=0
18 0.837261 172.27.129.248 111.206.223.168 TLSv1.2 234 Client Hello
19 0.902084 111.206.223.168 172.27.129.248 TCP 60 443  >  26841 [ACK] Seq=1 Ack=181 Win=30464 Len=0
20 0.902085 111.206.223.168 172.27.129.248 TLSv1.2 1514 Server Hello
21 0.902087 111.206.223.168 172.27.129.248 TCP 1514 443  >  26841 [ACK] Seq=1461 Ack=181 Win=30464 Len=1460 [TCP segment of a reassembled PDU]
22 0.902087 111.206.223.168 172.27.129.248 TLSv1.2 435 Certificate  Server Key Exchange  Server Hello Done
23 0.902087 111.206.223.168 172.27.129.248 TCP 435 [TCP Retransmission] 443  >  26841 [PSH  ACK] Seq=2921 Ack=181 Win=30464 Len=381
24 0.902258 172.27.129.248 111.206.223.168 TCP 54 26841  >  443 [ACK] Seq=181 Ack=2921 Win=132096 Len=0
25 0.902331 172.27.129.248 111.206.223.168 TCP 66 26841  >  443 [ACK] Seq=181 Ack=3302 Win=131584 Len=0 SLE=2921 SRE=3302
26 0.904046 172.27.129.248 111.206.223.168 TLSv1.2 180 Client Key Exchange  Change Cipher Spec  Encrypted Handshake Message
27 0.942491 111.206.223.168 172.27.129.248 TCP 60 443  >  26841 [ACK] Seq=3302 Ack=307 Win=30464 Len=0
28 0.942491 111.206.223.168 172.27.129.248 TLSv1.2 296 New Session Ticket  Change Cipher Spec  Encrypted Handshake Message
29 0.943103 172.27.129.248 111.206.223.168 TLSv1.2 1111 Application Data
30 1.004725 111.206.223.168 172.27.129.248 TCP 60 443  >  26841 [ACK] Seq=3544 Ack=1364 Win=33280 Len=0
33 1.103263 172.27.129.248 182.61.200.162 TCP 1506 26788  >  443 [ACK] Seq=1 Ack=1 Win=516 Len=1452 [TCP segment of a reassembled PDU]
34 1.103265 172.27.129.248 182.61.200.162 TLSv1.2 908 Application Data
35 1.104073 172.27.129.248 182.61.200.162 TCP 66 26842  >  443 [SYN] Seq=0 Win=64240 Len=0 MSS=1460 WS=256 SACK_PERM=1
36 1.107929 111.206.223.168 172.27.129.248 TLSv1.2 839 Application Data
37 1.107929 111.206.223.168 172.27.129.248 TLSv1.2 88 Application Data
38 1.107929 111.206.223.168 172.27.129.248 TCP 88 [TCP Retransmission] 443  >  26841 [PSH  ACK] Seq=4329 Ack=1364 Win=33280 Len=34
39 1.108032 172.27.129.248 111.206.223.168 TCP 54 26841  >  443 [ACK] Seq=1364 Ack=4363 Win=130560 Len=0
40 1.108076 172.27.129.248 111.206.223.168 TCP 66 [TCP Dup ACK 39#1] 26841  >  443 [ACK] Seq=1364 Ack=4363 Win=130560 Len=0 SLE=4329 SRE=4363
41 1.136887 182.61.200.162 172.27.129.248 TCP 60 443  >  26788 [ACK] Seq=1 Ack=2307 Win=1852 Len=0
42 1.141126 182.61.200.162 172.27.129.248 TCP 66 443  >  26842 [SYN  ACK] Seq=0 Ack=1 Win=8192 Len=0 MSS=1452 WS=32 SACK_PERM=1
43 1.141179 172.27.129.248 182.61.200.162 TCP 54 26842  >  443 [ACK] Seq=1 Ack=1 Win=132096 Len=0
44 1.151993 172.27.129.248 182.61.200.162 TLSv1.2 232 Client Hello
45 1.210563 182.61.200.162 172.27.129.248 TCP 60 443  >  26842 [ACK] Seq=1 Ack=179 Win=30336 Len=0
46 1.210563 182.61.200.162 172.27.129.248 TLSv1.2 107 Server Hello
47 1.210564 182.61.200.162 172.27.129.248 TCP 1514 443  >  26842 [ACK] Seq=54 Ack=179 Win=30336 Len=1460 [TCP segment of a reassembled PDU]
48 1.210565 182.61.200.162 172.27.129.248 TCP 1514 443  >  26842 [ACK] Seq=1514 Ack=179 Win=30336 Len=1460 [TCP segment of a reassembled PDU]
49 1.210566 182.61.200.162 172.27.129.248 TCP 1514 443  >  26842 [ACK] Seq=2974 Ack=179 Win=30336 Len=1460 [TCP segment of a reassembled PDU]
50 1.210566 182.61.200.162 172.27.129.248 TLSv1.2 426 Certificate
51 1.210566 182.61.200.162 172.27.129.248 TLSv1.2 392 Server Key Exchange
52 1.210566 182.61.200.162 172.27.129.248 TLSv1.2 63 Server Hello Done
53 1.210566 182.61.200.162 172.27.129.248 TCP 63 [TCP Retransmission] 443  >  26842 [PSH  ACK] Seq=5144 Ack=179 Win=30336 Len=9
54 1.210711 172.27.129.248 182.61.200.162 TCP 54 26842  >  443 [ACK] Seq=179 Ack=1514 Win=132096 Len=0
55 1.210792 172.27.129.248 182.61.200.162 TCP 54 26842  >  443 [ACK] Seq=179 Ack=4434 Win=132096 Len=0
56 1.210856 172.27.129.248 182.61.200.162 TCP 54 26842  >  443 [ACK] Seq=179 Ack=5144 Win=131328 Len=0
57 1.210909 172.27.129.248 182.61.200.162 TCP 66 26842  >  443 [ACK] Seq=179 Ack=5153 Win=131328 Len=0 SLE=5144 SRE=5153
58 1.212384 172.27.129.248 182.61.200.162 TLSv1.2 180 Client Key Exchange  Change Cipher Spec  Encrypted Handshake Message
59 1.242913 182.61.200.162 172.27.129.248 TCP 60 443  >  26842 [ACK] Seq=5153 Ack=305 Win=30336 Len=0
60 1.242913 182.61.200.162 172.27.129.248 TLSv1.2 173 New Session Ticket
61 1.242914 182.61.200.162 172.27.129.248 TLSv1.2 60 Change Cipher Spec
62 1.242914 182.61.200.162 172.27.129.248 TLSv1.2 99 Encrypted Handshake Message
63 1.243038 172.27.129.248 182.61.200.162 TCP 54 26842  >  443 [ACK] Seq=305 Ack=5278 Win=131072 Len=0
64 1.243618 172.27.129.248 182.61.200.162 TCP 1506 26842  >  443 [ACK] Seq=305 Ack=5323 Win=131072 Len=1452 [TCP segment of a reassembled PDU]
65 1.243620 172.27.129.248 182.61.200.162 TLSv1.2 962 Application Data
66 1.312743 182.61.200.162 172.27.129.248 TCP 60 443  >  26842 [ACK] Seq=5323 Ack=2665 Win=35072 Len=0
67 1.356385 172.27.129.248 58.220.106.117 ICMP 74 Echo (ping) request  id=0x0001  seq=1878/22023  ttl=64 (reply in 68)
68 1.414363 58.220.106.117 172.27.129.248 ICMP 74 Echo (ping) reply    id=0x0001  seq=1878/22023  ttl=248 (request in 67)
69 1.419607 172.27.129.248 182.61.200.162 TCP 66 26843  >  443 [SYN] Seq=0 Win=64240 Len=0 MSS=1460 WS=256 SACK_PERM=1
70 1.454534 182.61.200.162 172.27.129.248 TCP 66 443  >  26843 [SYN  ACK] Seq=0 Ack=1 Win=8192 Len=0 MSS=1452 WS=32 SACK_PERM=1
71 1.454596 172.27.129.248 182.61.200.162 TCP 54 26843  >  443 [ACK] Seq=1 Ack=1 Win=132096 Len=0
72 1.465062 172.27.129.248 182.61.200.162 TLSv1.2 336 Client Hello
73 1.549621 182.61.200.162 172.27.129.248 TCP 60 443  >  26843 [ACK] Seq=1 Ack=283 Win=30336 Len=0
74 1.549621 182.61.200.162 172.27.129.248 TLSv1.2 101 Server Hello
75 1.549622 182.61.200.162 172.27.129.248 TLSv1.2 60 Change Cipher Spec
76 1.549622 182.61.200.162 172.27.129.248 TLSv1.2 99 Encrypted Handshake Message
77 1.549746 172.27.129.248 182.61.200.162 TCP 54 26843  >  443 [ACK] Seq=283 Ack=54 Win=131840 Len=0
78 1.550272 172.27.129.248 182.61.200.162 TLSv1.2 105 Change Cipher Spec  Encrypted Handshake Message
79 1.550331 172.27.129.248 182.61.200.162 TCP 1506 26843  >  443 [ACK] Seq=334 Ack=99 Win=131840 Len=1452 [TCP segment of a reassembled PDU]
80 1.550333 172.27.129.248 182.61.200.162 TCP 1506 26843  >  443 [ACK] Seq=1786 Ack=99 Win=131840 Len=1452 [TCP segment of a reassembled PDU]
81 1.550333 172.27.129.248 182.61.200.162 TLSv1.2 123 Application Data
82 1.559073 182.61.200.162 172.27.129.248 TLSv1.2 99 [TCP Spurious Retransmission]   Encrypted Handshake Message
83 1.559154 172.27.129.248 182.61.200.162 TCP 66 [TCP Dup ACK 78#1] 26843  >  443 [ACK] Seq=3307 Ack=99 Win=131840 Len=0 SLE=54 SRE=99
84 1.618905 182.61.200.162 172.27.129.248 TCP 60 443  >  26843 [ACK] Seq=99 Ack=334 Win=30336 Len=0
85 1.618905 182.61.200.162 172.27.129.248 TCP 60 443  >  26843 [ACK] Seq=99 Ack=3238 Win=36096 Len=0
86 1.618905 182.61.200.162 172.27.129.248 TCP 60 443  >  26843 [ACK] Seq=99 Ack=3307 Win=36096 Len=0
87 1.618905 182.61.200.162 172.27.129.248 TLSv1.2 791 Application Data
88 1.639010 172.27.129.248 182.61.200.162 TCP 66 26844  >  443 [SYN] Seq=0 Win=64240 Len=0 MSS=1460 WS=256 SACK_PERM=1
89 1.659224 172.27.129.248 182.61.200.162 TCP 54 26788  >  443 [ACK] Seq=2307 Ack=738 Win=513 Len=0
90 1.723200 182.61.200.162 172.27.129.248 TCP 66 443  >  26844 [SYN  ACK] Seq=0 Ack=1 Win=8192 Len=0 MSS=1452 WS=32 SACK_PERM=1
91 1.723270 172.27.129.248 182.61.200.162 TCP 54 26844  >  443 [ACK] Seq=1 Ack=1 Win=132096 Len=0
92 1.723486 172.27.129.248 182.61.200.162 TLSv1.2 571 Client Hello
93 1.747419 172.27.129.248 182.61.200.162 TCP 1506 26788  >  443 [ACK] Seq=2307 Ack=738 Win=513 Len=1452 [TCP segment of a reassembled PDU]
94 1.747421 172.27.129.248 182.61.200.162 TCP 1506 26788  >  443 [ACK] Seq=3759 Ack=738 Win=513 Len=1452 [TCP segment of a reassembled PDU]
95 1.747421 172.27.129.248 182.61.200.162 TLSv1.2 815 Application Data
96 1.751523 182.61.200.162 172.27.129.248 TCP 60 443  >  26844 [ACK] Seq=1 Ack=518 Win=30336 Len=0
97 1.751523 182.61.200.162 172.27.129.248 TLSv1.2 140 Server Hello
98 1.751523 182.61.200.162 172.27.129.248 TLSv1.2 60 Change Cipher Spec
99 1.751523 182.61.200.162 172.27.129.248 TLSv1.2 99 Encrypted Handshake Message
100 1.751643 172.27.129.248 182.61.200.162 TCP 54 26844  >  443 [ACK] Seq=518 Ack=93 Win=131840 Len=0
101 1.751821 172.27.129.248 182.61.200.162 TLSv1.2 105 Change Cipher Spec  Encrypted Handshake Message
102 1.761661 182.61.200.162 172.27.129.248 TLSv1.2 99 [TCP Spurious Retransmission]   Encrypted Handshake Message
103 1.761719 172.27.129.248 182.61.200.162 TCP 66 [TCP Dup ACK 101#1] 26844  >  443 [ACK] Seq=569 Ack=138 Win=131840 Len=0 SLE=93 SRE=138
104 1.774712 172.27.129.248 210.28.129.251 DNS 77 Standard query 0x46a1 A pcsdata.baidu.com
105 1.818552 172.27.129.248 182.61.200.162 TCP 66 26845  >  443 [SYN] Seq=0 Win=64240 Len=0 MSS=1460 WS=256 SACK_PERM=1
106 1.823811 182.61.200.162 172.27.129.248 TCP 60 443  >  26788 [ACK] Seq=738 Ack=5211 Win=2032 Len=0
107 1.823812 182.61.200.162 172.27.129.248 TCP 60 443  >  26788 [ACK] Seq=738 Ack=5972 Win=2124 Len=0
108 1.823812 182.61.200.162 172.27.129.248 TLSv1.2 809 Application Data
109 1.823814 182.61.200.162 172.27.129.248 TCP 60 443  >  26844 [ACK] Seq=138 Ack=569 Win=30336 Len=0
110 1.823936 172.27.129.248 182.61.200.162 TLSv1.2 856 Application Data
111 1.826416 210.28.129.251 172.27.129.248 DNS 124 Standard query response 0x46a1 A pcsdata.baidu.com CNAME pcsdata.n.shifen.com A 111.202.114.27
112 1.829441 172.27.129.248 182.61.200.162 TCP 66 26846  >  443 [SYN] Seq=0 Win=64240 Len=0 MSS=1460 WS=256 SACK_PERM=1
113 1.841884 172.27.129.248 111.202.114.27 TCP 66 26848  >  443 [SYN] Seq=0 Win=64240 Len=0 MSS=1460 WS=256 SACK_PERM=1
114 1.842100 172.27.129.248 111.202.114.27 TCP 66 26849  >  443 [SYN] Seq=0 Win=64240 Len=0 MSS=1460 WS=256 SACK_PERM=1
115 1.842231 172.27.129.248 111.202.114.27 TCP 66 26850  >  443 [SYN] Seq=0 Win=64240 Len=0 MSS=1460 WS=256 SACK_PERM=1
116 1.842403 172.27.129.248 111.202.114.27 TCP 66 26851  >  443 [SYN] Seq=0 Win=64240 Len=0 MSS=1460 WS=256 SACK_PERM=1
117 1.842591 172.27.129.248 111.202.114.27 TCP 66 26852  >  443 [SYN] Seq=0 Win=64240 Len=0 MSS=1460 WS=256 SACK_PERM=1
118 1.842986 172.27.129.248 111.202.114.27 TCP 66 26853  >  443 [SYN] Seq=0 Win=64240 Len=0 MSS=1460 WS=256 SACK_PERM=1
119 1.843288 172.27.129.248 111.202.114.27 TCP 66 26854  >  443 [SYN] Seq=0 Win=64240 Len=0 MSS=1460 WS=256 SACK_PERM=1
120 1.843546 172.27.129.248 111.202.114.27 TCP 66 26855  >  443 [SYN] Seq=0 Win=64240 Len=0 MSS=1460 WS=256 SACK_PERM=1
121 1.843784 172.27.129.248 111.202.114.27 TCP 66 26856  >  443 [SYN] Seq=0 Win=64240 Len=0 MSS=1460 WS=256 SACK_PERM=1
122 1.844160 172.27.129.248 111.202.114.27 TCP 66 26857  >  443 [SYN] Seq=0 Win=64240 Len=0 MSS=1460 WS=256 SACK_PERM=1
123 1.844313 172.27.129.248 111.202.114.27 TCP 66 26858  >  443 [SYN] Seq=0 Win=64240 Len=0 MSS=1460 WS=256 SACK_PERM=1
124 1.844511 172.27.129.248 111.202.114.27 TCP 66 26859  >  443 [SYN] Seq=0 Win=64240 Len=0 MSS=1460 WS=256 SACK_PERM=1
125 1.844782 172.27.129.248 111.202.114.27 TCP 66 26860  >  443 [SYN] Seq=0 Win=64240 Len=0 MSS=1460 WS=256 SACK_PERM=1
126 1.845024 172.27.129.248 111.202.114.27 TCP 66 26861  >  443 [SYN] Seq=0 Win=64240 Len=0 MSS=1460 WS=256 SACK_PERM=1
127 1.845290 172.27.129.248 111.202.114.27 TCP 66 26862  >  443 [SYN] Seq=0 Win=64240 Len=0 MSS=1460 WS=256 SACK_PERM=1
128 1.845551 172.27.129.248 111.202.114.27 TCP 66 26863  >  443 [SYN] Seq=0 Win=64240 Len=0 MSS=1460 WS=256 SACK_PERM=1
129 1.845918 172.27.129.248 111.202.114.27 TCP 66 26864  >  443 [SYN] Seq=0 Win=64240 Len=0 MSS=1460 WS=256 SACK_PERM=1
130 1.846180 172.27.129.248 111.202.114.27 TCP 66 26865  >  443 [SYN] Seq=0 Win=64240 Len=0 MSS=1460 WS=256 SACK_PERM=1
131 1.846488 172.27.129.248 111.202.114.27 TCP 66 26866  >  443 [SYN] Seq=0 Win=64240 Len=0 MSS=1460 WS=256 SACK_PERM=1
132 1.852375 182.61.200.162 172.27.129.248 TCP 60 443  >  26844 [ACK] Seq=138 Ack=1371 Win=33280 Len=0
133 1.854524 182.61.200.162 172.27.129.248 TCP 66 443  >  26845 [SYN  ACK] Seq=0 Ack=1 Win=8192 Len=0 MSS=1452 WS=32 SACK_PERM=1
134 1.854577 172.27.129.248 182.61.200.162 TCP 54 26845  >  443 [ACK] Seq=1 Ack=1 Win=132096 Len=0
135 1.854921 172.27.129.248 182.61.200.162 TLSv1.2 232 Client Hello
136 1.861836 182.61.200.162 172.27.129.248 TCP 66 443  >  26846 [SYN  ACK] Seq=0 Ack=1 Win=8192 Len=0 MSS=1452 WS=32 SACK_PERM=1
137 1.861905 172.27.129.248 182.61.200.162 TCP 54 26846  >  443 [ACK] Seq=1 Ack=1 Win=132096 Len=0
138 1.862064 172.27.129.248 182.61.200.162 TLSv1.2 571 Client Hello
139 1.864692 172.27.129.248 182.61.200.162 TCP 54 26842  >  443 [ACK] Seq=2665 Ack=6078 Win=132096 Len=0
140 1.867976 111.202.114.27 172.27.129.248 TCP 66 443  >  26851 [SYN  ACK] Seq=0 Ack=1 Win=8192 Len=0 MSS=1452 WS=32 SACK_PERM=1
141 1.867976 111.202.114.27 172.27.129.248 TCP 66 443  >  26848 [SYN  ACK] Seq=0 Ack=1 Win=8192 Len=0 MSS=1452 WS=32 SACK_PERM=1
142 1.867977 111.202.114.27 172.27.129.248 TCP 66 443  >  26858 [SYN  ACK] Seq=0 Ack=1 Win=8192 Len=0 MSS=1452 WS=32 SACK_PERM=1
143 1.867977 111.202.114.27 172.27.129.248 TCP 66 443  >  26859 [SYN  ACK] Seq=0 Ack=1 Win=8192 Len=0 MSS=1452 WS=32 SACK_PERM=1
144 1.868062 172.27.129.248 111.202.114.27 TCP 54 26851  >  443 [ACK] Seq=1 Ack=1 Win=132096 Len=0
145 1.868076 172.27.129.248 111.202.114.27 TCP 54 26848  >  443 [ACK] Seq=1 Ack=1 Win=132096 Len=0
146 1.868088 172.27.129.248 111.202.114.27 TCP 54 26858  >  443 [ACK] Seq=1 Ack=1 Win=132096 Len=0
147 1.868098 172.27.129.248 111.202.114.27 TCP 54 26859  >  443 [ACK] Seq=1 Ack=1 Win=132096 Len=0
148 1.878939 172.27.129.248 111.202.114.27 TLSv1.2 412 Client Hello
149 1.879162 172.27.129.248 111.202.114.27 TLSv1.2 412 Client Hello
150 1.879316 172.27.129.248 111.202.114.27 TLSv1.2 412 Client Hello
151 1.879514 172.27.129.248 111.202.114.27 TLSv1.2 412 Client Hello
152 1.926988 111.202.114.27 172.27.129.248 TCP 66 443  >  26852 [SYN  ACK] Seq=0 Ack=1 Win=8192 Len=0 MSS=1452 WS=32 SACK_PERM=1
153 1.926988 111.202.114.27 172.27.129.248 TCP 66 443  >  26863 [SYN  ACK] Seq=0 Ack=1 Win=8192 Len=0 MSS=1452 WS=32 SACK_PERM=1
154 1.926988 111.202.114.27 172.27.129.248 TCP 66 443  >  26855 [SYN  ACK] Seq=0 Ack=1 Win=8192 Len=0 MSS=1452 WS=32 SACK_PERM=1
155 1.926988 111.202.114.27 172.27.129.248 TCP 66 443  >  26864 [SYN  ACK] Seq=0 Ack=1 Win=8192 Len=0 MSS=1452 WS=32 SACK_PERM=1
156 1.926989 111.202.114.27 172.27.129.248 TCP 66 443  >  26866 [SYN  ACK] Seq=0 Ack=1 Win=8192 Len=0 MSS=1452 WS=32 SACK_PERM=1
157 1.926989 111.202.114.27 172.27.129.248 TCP 66 443  >  26862 [SYN  ACK] Seq=0 Ack=1 Win=8192 Len=0 MSS=1452 WS=32 SACK_PERM=1
158 1.926989 111.202.114.27 172.27.129.248 TCP 66 443  >  26850 [SYN  ACK] Seq=0 Ack=1 Win=8192 Len=0 MSS=1452 WS=32 SACK_PERM=1
159 1.926990 111.202.114.27 172.27.129.248 TCP 66 443  >  26849 [SYN  ACK] Seq=0 Ack=1 Win=8192 Len=0 MSS=1452 WS=32 SACK_PERM=1
160 1.926990 111.202.114.27 172.27.129.248 TCP 66 443  >  26854 [SYN  ACK] Seq=0 Ack=1 Win=8192 Len=0 MSS=1452 WS=32 SACK_PERM=1
161 1.926990 111.202.114.27 172.27.129.248 TCP 66 443  >  26857 [SYN  ACK] Seq=0 Ack=1 Win=8192 Len=0 MSS=1452 WS=32 SACK_PERM=1
162 1.926990 111.202.114.27 172.27.129.248 TCP 66 443  >  26853 [SYN  ACK] Seq=0 Ack=1 Win=8192 Len=0 MSS=1452 WS=32 SACK_PERM=1
163 1.926990 111.202.114.27 172.27.129.248 TCP 66 443  >  26860 [SYN  ACK] Seq=0 Ack=1 Win=8192 Len=0 MSS=1452 WS=32 SACK_PERM=1
164 1.926990 111.202.114.27 172.27.129.248 TCP 66 443  >  26856 [SYN  ACK] Seq=0 Ack=1 Win=8192 Len=0 MSS=1452 WS=32 SACK_PERM=1
165 1.926991 111.202.114.27 172.27.129.248 TCP 66 443  >  26861 [SYN  ACK] Seq=0 Ack=1 Win=8192 Len=0 MSS=1452 WS=32 SACK_PERM=1
166 1.926991 111.202.114.27 172.27.129.248 TCP 66 443  >  26865 [SYN  ACK] Seq=0 Ack=1 Win=8192 Len=0 MSS=1452 WS=32 SACK_PERM=1
167 1.926992 182.61.200.162 172.27.129.248 TCP 60 443  >  26845 [ACK] Seq=1 Ack=179 Win=30336 Len=0
168 1.927386 172.27.129.248 111.202.114.27 TCP 54 26852  >  443 [ACK] Seq=1 Ack=1 Win=132096 Len=0
169 1.927420 172.27.129.248 111.202.114.27 TCP 54 26863  >  443 [ACK] Seq=1 Ack=1 Win=132096 Len=0
170 1.927431 172.27.129.248 111.202.114.27 TCP 54 26855  >  443 [ACK] Seq=1 Ack=1 Win=132096 Len=0
171 1.927443 172.27.129.248 111.202.114.27 TCP 54 26864  >  443 [ACK] Seq=1 Ack=1 Win=132096 Len=0
172 1.927458 172.27.129.248 111.202.114.27 TCP 54 26866  >  443 [ACK] Seq=1 Ack=1 Win=132096 Len=0
173 1.927473 172.27.129.248 111.202.114.27 TCP 54 26862  >  443 [ACK] Seq=1 Ack=1 Win=132096 Len=0
174 1.927490 172.27.129.248 111.202.114.27 TCP 54 26850  >  443 [ACK] Seq=1 Ack=1 Win=132096 Len=0
175 1.927504 172.27.129.248 111.202.114.27 TLSv1.2 412 Client Hello
176 1.927507 172.27.129.248 111.202.114.27 TCP 54 26849  >  443 [ACK] Seq=1 Ack=1 Win=132096 Len=0
177 1.927526 172.27.129.248 111.202.114.27 TCP 54 26854  >  443 [ACK] Seq=1 Ack=1 Win=132096 Len=0
178 1.927541 172.27.129.248 111.202.114.27 TCP 54 26857  >  443 [ACK] Seq=1 Ack=1 Win=132096 Len=0
179 1.927554 172.27.129.248 111.202.114.27 TCP 54 26853  >  443 [ACK] Seq=1 Ack=1 Win=132096 Len=0
180 1.927567 172.27.129.248 111.202.114.27 TCP 54 26860  >  443 [ACK] Seq=1 Ack=1 Win=132096 Len=0
181 1.927581 172.27.129.248 111.202.114.27 TCP 54 26856  >  443 [ACK] Seq=1 Ack=1 Win=132096 Len=0
182 1.927595 172.27.129.248 111.202.114.27 TCP 54 26861  >  443 [ACK] Seq=1 Ack=1 Win=132096 Len=0
183 1.927608 172.27.129.248 111.202.114.27 TCP 54 26865  >  443 [ACK] Seq=1 Ack=1 Win=132096 Len=0
184 1.927697 172.27.129.248 111.202.114.27 TLSv1.2 412 Client Hello
185 1.927711 182.61.200.162 172.27.129.248 TLSv1.2 107 Server Hello
186 1.927711 182.61.200.162 172.27.129.248 TCP 1514 443  >  26845 [ACK] Seq=54 Ack=179 Win=30336 Len=1460 [TCP segment of a reassembled PDU]
187 1.927712 182.61.200.162 172.27.129.248 TCP 1514 443  >  26845 [ACK] Seq=1514 Ack=179 Win=30336 Len=1460 [TCP segment of a reassembled PDU]
188 1.927712 182.61.200.162 172.27.129.248 TCP 1514 443  >  26845 [ACK] Seq=2974 Ack=179 Win=30336 Len=1460 [TCP segment of a reassembled PDU]
189 1.927713 182.61.200.162 172.27.129.248 TLSv1.2 426 Certificate
190 1.927713 182.61.200.162 172.27.129.248 TLSv1.2 392 Server Key Exchange
191 1.927713 182.61.200.162 172.27.129.248 TLSv1.2 63 Server Hello Done
192 1.927713 182.61.200.162 172.27.129.248 TCP 60 443  >  26846 [ACK] Seq=1 Ack=518 Win=30336 Len=0
193 1.927713 182.61.200.162 172.27.129.248 TLSv1.2 140 Server Hello
194 1.927714 182.61.200.162 172.27.129.248 TLSv1.2 60 Change Cipher Spec
195 1.927714 182.61.200.162 172.27.129.248 TLSv1.2 99 Encrypted Handshake Message
196 1.927714 182.61.200.162 172.27.129.248 TCP 63 [TCP Retransmission] 443  >  26845 [PSH  ACK] Seq=5144 Ack=179 Win=30336 Len=9
197 1.927714 182.61.200.162 172.27.129.248 TCP 99 [TCP Retransmission] 443  >  26846 [PSH  ACK] Seq=93 Ack=518 Win=30336 Len=45
198 1.927807 172.27.129.248 182.61.200.162 TCP 54 26845  >  443 [ACK] Seq=179 Ack=1514 Win=132096 Len=0
199 1.927826 172.27.129.248 111.202.114.27 TLSv1.2 412 Client Hello
200 1.927857 172.27.129.248 182.61.200.162 TCP 54 26846  >  443 [ACK] Seq=518 Ack=93 Win=131840 Len=0
201 1.927881 172.27.129.248 182.61.200.162 TCP 54 26845  >  443 [ACK] Seq=179 Ack=4434 Win=132096 Len=0
202 1.927924 172.27.129.248 182.61.200.162 TCP 66 26846  >  443 [ACK] Seq=518 Ack=138 Win=131840 Len=0 SLE=93 SRE=138
203 1.927968 172.27.129.248 111.202.114.27 TLSv1.2 412 Client Hello
204 1.927983 172.27.129.248 182.61.200.162 TCP 54 26845  >  443 [ACK] Seq=179 Ack=5144 Win=131328 Len=0
205 1.928031 172.27.129.248 182.61.200.162 TLSv1.2 105 Change Cipher Spec  Encrypted Handshake Message
206 1.928048 172.27.129.248 182.61.200.162 TCP 66 26845  >  443 [ACK] Seq=179 Ack=5153 Win=131328 Len=0 SLE=5144 SRE=5153
207 1.928170 172.27.129.248 111.202.114.27 TLSv1.2 412 Client Hello
208 1.928327 172.27.129.248 111.202.114.27 TLSv1.2 412 Client Hello
209 1.928499 172.27.129.248 111.202.114.27 TLSv1.2 412 Client Hello
210 1.928638 172.27.129.248 111.202.114.27 TLSv1.2 412 Client Hello
211 1.928872 172.27.129.248 111.202.114.27 TLSv1.2 236 Client Hello
212 1.929082 172.27.129.248 111.202.114.27 TLSv1.2 236 Client Hello
213 1.929284 172.27.129.248 111.202.114.27 TLSv1.2 236 Client Hello
214 1.929499 172.27.129.248 111.202.114.27 TLSv1.2 236 Client Hello
215 1.929713 172.27.129.248 111.202.114.27 TLSv1.2 236 Client Hello
216 1.929869 172.27.129.248 111.202.114.27 TLSv1.2 412 Client Hello
217 1.930022 172.27.129.248 111.202.114.27 TLSv1.2 412 Client Hello
218 1.930079 172.27.129.248 182.61.200.162 TLSv1.2 180 Client Key Exchange  Change Cipher Spec  Encrypted Handshake Message
219 1.946116 172.27.129.248 182.61.200.162 TCP 1506 26842  >  443 [ACK] Seq=2665 Ack=6078 Win=132096 Len=1452 [TCP segment of a reassembled PDU]
220 1.946117 172.27.129.248 182.61.200.162 TLSv1.2 907 Application Data
221 1.953752 111.202.114.27 172.27.129.248 TCP 60 443  >  26858 [ACK] Seq=1 Ack=359 Win=30464 Len=0
222 1.953752 111.202.114.27 172.27.129.248 TCP 60 443  >  26859 [ACK] Seq=1 Ack=359 Win=30464 Len=0
223 1.955024 111.202.114.27 172.27.129.248 TCP 60 443  >  26851 [ACK] Seq=1 Ack=359 Win=30464 Len=0
224 1.955024 111.202.114.27 172.27.129.248 TCP 60 443  >  26848 [ACK] Seq=1 Ack=359 Win=30464 Len=0
225 1.955489 111.202.114.27 172.27.129.248 TLSv1.2 1514 Server Hello
226 1.955490 111.202.114.27 172.27.129.248 TLSv1.2 1514 Server Hello
227 1.955491 111.202.114.27 172.27.129.248 TCP 1514 443  >  26858 [ACK] Seq=1461 Ack=359 Win=30464 Len=1460 [TCP segment of a reassembled PDU]
228 1.955491 111.202.114.27 172.27.129.248 TLSv1.2 435 Certificate  Server Key Exchange  Server Hello Done
229 1.955612 172.27.129.248 111.202.114.27 TCP 54 26858  >  443 [ACK] Seq=359 Ack=2921 Win=132096 Len=0
230 1.955952 111.202.114.27 172.27.129.248 TCP 60 443  >  26863 [ACK] Seq=1 Ack=183 Win=30464 Len=0
231 1.955952 111.202.114.27 172.27.129.248 TCP 1514 443  >  26859 [ACK] Seq=1461 Ack=359 Win=30464 Len=1460 [TCP segment of a reassembled PDU]
232 1.955953 111.202.114.27 172.27.129.248 TLSv1.2 435 Certificate  Server Key Exchange  Server Hello Done
233 1.955953 111.202.114.27 172.27.129.248 TLSv1.2 1514 Server Hello
234 1.955954 111.202.114.27 172.27.129.248 TCP 1514 443  >  26848 [ACK] Seq=1461 Ack=359 Win=30464 Len=1460 [TCP segment of a reassembled PDU]
235 1.955954 111.202.114.27 172.27.129.248 TLSv1.2 1514 Server Hello
236 1.955954 111.202.114.27 172.27.129.248 TLSv1.2 435 Certificate  Server Key Exchange  Server Hello Done
237 1.956042 172.27.129.248 111.202.114.27 TCP 54 26859  >  443 [ACK] Seq=359 Ack=2921 Win=132096 Len=0
238 1.956122 172.27.129.248 111.202.114.27 TCP 54 26848  >  443 [ACK] Seq=359 Ack=2921 Win=132096 Len=0
239 1.956305 111.202.114.27 172.27.129.248 TCP 1514 443  >  26851 [ACK] Seq=1461 Ack=359 Win=30464 Len=1460 [TCP segment of a reassembled PDU]
240 1.956305 111.202.114.27 172.27.129.248 TCP 60 443  >  26852 [ACK] Seq=1 Ack=359 Win=30464 Len=0
241 1.956306 111.202.114.27 172.27.129.248 TLSv1.2 435 Certificate  Server Key Exchange  Server Hello Done
242 1.956345 172.27.129.248 111.202.114.27 TCP 54 26851  >  443 [ACK] Seq=359 Ack=2921 Win=132096 Len=0
243 1.956841 172.27.129.248 111.202.114.27 TLSv1.2 180 Client Key Exchange  Change Cipher Spec  Encrypted Handshake Message
244 1.957655 111.202.114.27 172.27.129.248 TCP 60 443  >  26864 [ACK] Seq=1 Ack=183 Win=30464 Len=0
245 1.957655 111.202.114.27 172.27.129.248 TCP 60 443  >  26855 [ACK] Seq=1 Ack=359 Win=30464 Len=0
246 1.957655 111.202.114.27 172.27.129.248 TCP 60 443  >  26866 [ACK] Seq=1 Ack=183 Win=30464 Len=0
247 1.957656 111.202.114.27 172.27.129.248 TCP 60 443  >  26862 [ACK] Seq=1 Ack=183 Win=30464 Len=0
248 1.957824 172.27.129.248 111.202.114.27 TLSv1.2 180 Client Key Exchange  Change Cipher Spec  Encrypted Handshake Message
249 1.958709 111.202.114.27 172.27.129.248 TLSv1.2 1514 Server Hello
250 1.958710 111.202.114.27 172.27.129.248 TCP 1514 443  >  26863 [ACK] Seq=1461 Ack=183 Win=30464 Len=1460 [TCP segment of a reassembled PDU]
251 1.958711 111.202.114.27 172.27.129.248 TLSv1.2 435 Certificate  Server Key Exchange  Server Hello Done
252 1.958711 111.202.114.27 172.27.129.248 TLSv1.2 1514 Server Hello
253 1.958711 111.202.114.27 172.27.129.248 TLSv1.2 1514 Server Hello
254 1.958711 111.202.114.27 172.27.129.248 TCP 1514 443  >  26852 [ACK] Seq=1461 Ack=359 Win=30464 Len=1460 [TCP segment of a reassembled PDU]
255 1.958712 111.202.114.27 172.27.129.248 TLSv1.2 435 Certificate  Server Key Exchange  Server Hello Done
256 1.958712 111.202.114.27 172.27.129.248 TCP 1514 443  >  26855 [ACK] Seq=1461 Ack=359 Win=30464 Len=1460 [TCP segment of a reassembled PDU]
257 1.958827 172.27.129.248 111.202.114.27 TLSv1.2 180 Client Key Exchange  Change Cipher Spec  Encrypted Handshake Message
258 1.958832 172.27.129.248 111.202.114.27 TCP 54 26863  >  443 [ACK] Seq=183 Ack=2921 Win=132096 Len=0
259 1.958845 111.202.114.27 172.27.129.248 TLSv1.2 435 Certificate  Server Key Exchange  Server Hello Done
260 1.958845 111.202.114.27 172.27.129.248 TLSv1.2 1514 Server Hello
261 1.958891 172.27.129.248 111.202.114.27 TCP 54 26852  >  443 [ACK] Seq=359 Ack=2921 Win=132096 Len=0
262 1.958953 172.27.129.248 111.202.114.27 TCP 54 26855  >  443 [ACK] Seq=359 Ack=2921 Win=132096 Len=0
263 1.959444 111.202.114.27 172.27.129.248 TCP 1514 443  >  26864 [ACK] Seq=1461 Ack=183 Win=30464 Len=1460 [TCP segment of a reassembled PDU]
264 1.959445 111.202.114.27 172.27.129.248 TLSv1.2 435 Certificate  Server Key Exchange  Server Hello Done
265 1.959446 111.202.114.27 172.27.129.248 TCP 60 443  >  26860 [ACK] Seq=1 Ack=359 Win=30464 Len=0
266 1.959446 111.202.114.27 172.27.129.248 TCP 60 443  >  26854 [ACK] Seq=1 Ack=359 Win=30464 Len=0
267 1.959446 111.202.114.27 172.27.129.248 TLSv1.2 1514 Server Hello
268 1.959446 111.202.114.27 172.27.129.248 TCP 1514 443  >  26862 [ACK] Seq=1461 Ack=183 Win=30464 Len=1460 [TCP segment of a reassembled PDU]
269 1.959447 111.202.114.27 172.27.129.248 TLSv1.2 435 Certificate  Server Key Exchange  Server Hello Done
270 1.959447 111.202.114.27 172.27.129.248 TCP 60 443  >  26853 [ACK] Seq=1 Ack=359 Win=30464 Len=0
271 1.959498 172.27.129.248 111.202.114.27 TCP 54 26864  >  443 [ACK] Seq=183 Ack=2921 Win=132096 Len=0
272 1.959576 172.27.129.248 111.202.114.27 TCP 54 26862  >  443 [ACK] Seq=183 Ack=2921 Win=132096 Len=0
273 1.959841 172.27.129.248 111.202.114.27 TLSv1.2 180 Client Key Exchange  Change Cipher Spec  Encrypted Handshake Message
274 1.960131 111.202.114.27 172.27.129.248 TLSv1.2 1514 Server Hello
275 1.960132 111.202.114.27 172.27.129.248 TCP 1514 443  >  26866 [ACK] Seq=1461 Ack=183 Win=30464 Len=1460 [TCP segment of a reassembled PDU]
276 1.960132 111.202.114.27 172.27.129.248 TLSv1.2 435 Certificate  Server Key Exchange  Server Hello Done
277 1.960133 111.202.114.27 172.27.129.248 TCP 60 443  >  26857 [ACK] Seq=1 Ack=359 Win=30464 Len=0
278 1.960259 172.27.129.248 111.202.114.27 TCP 54 26866  >  443 [ACK] Seq=183 Ack=2921 Win=132096 Len=0
279 1.960839 172.27.129.248 111.202.114.27 TLSv1.2 180 Client Key Exchange  Change Cipher Spec  Encrypted Handshake Message
280 1.960877 111.202.114.27 172.27.129.248 TCP 60 443  >  26861 [ACK] Seq=1 Ack=359 Win=30464 Len=0
281 1.960877 182.61.200.162 172.27.129.248 TCP 60 443  >  26846 [ACK] Seq=138 Ack=569 Win=30336 Len=0
282 1.960877 182.61.200.162 172.27.129.248 TCP 60 443  >  26845 [ACK] Seq=5153 Ack=305 Win=30336 Len=0
283 1.960877 182.61.200.162 172.27.129.248 TLSv1.2 173 New Session Ticket
284 1.960878 182.61.200.162 172.27.129.248 TLSv1.2 60 Change Cipher Spec
285 1.960878 182.61.200.162 172.27.129.248 TLSv1.2 99 Encrypted Handshake Message
286 1.960878 111.202.114.27 172.27.129.248 TCP 60 443  >  26856 [ACK] Seq=1 Ack=359 Win=30464 Len=0
287 1.960878 111.202.114.27 172.27.129.248 TCP 60 443  >  26865 [ACK] Seq=1 Ack=183 Win=30464 Len=0
288 1.961007 172.27.129.248 182.61.200.162 TLSv1.2 873 Application Data
289 1.961018 172.27.129.248 182.61.200.162 TCP 54 26845  >  443 [ACK] Seq=305 Ack=5278 Win=131072 Len=0
290 1.961193 111.202.114.27 172.27.129.248 TLSv1.2 1514 Server Hello
291 1.961472 172.27.129.248 182.61.200.162 TCP 1506 26845  >  443 [ACK] Seq=305 Ack=5323 Win=131072 Len=1452 [TCP segment of a reassembled PDU]
292 1.961473 172.27.129.248 182.61.200.162 TCP 1506 26845  >  443 [ACK] Seq=1757 Ack=5323 Win=131072 Len=1452 [TCP segment of a reassembled PDU]
293 1.961474 172.27.129.248 182.61.200.162 TLSv1.2 920 Application Data
294 1.961943 111.202.114.27 172.27.129.248 TCP 1514 443  >  26860 [ACK] Seq=1461 Ack=359 Win=30464 Len=1460 [TCP segment of a reassembled PDU]
295 1.961944 111.202.114.27 172.27.129.248 TCP 60 443  >  26850 [ACK] Seq=1 Ack=359 Win=30464 Len=0
296 1.961944 111.202.114.27 172.27.129.248 TLSv1.2 435 Certificate  Server Key Exchange  Server Hello Done
297 1.961945 111.202.114.27 172.27.129.248 TLSv1.2 1514 Server Hello
298 1.961945 111.202.114.27 172.27.129.248 TLSv1.2 1514 Server Hello
299 1.961945 111.202.114.27 172.27.129.248 TCP 1514 443  >  26853 [ACK] Seq=1461 Ack=359 Win=30464 Len=1460 [TCP segment of a reassembled PDU]
300 1.961945 111.202.114.27 172.27.129.248 TLSv1.2 435 Certificate  Server Key Exchange  Server Hello Done
301 1.961946 111.202.114.27 172.27.129.248 TCP 60 443  >  26849 [ACK] Seq=1 Ack=359 Win=30464 Len=0
302 1.961979 172.27.129.248 111.202.114.27 TLSv1.2 180 Client Key Exchange  Change Cipher Spec  Encrypted Handshake Message
303 1.962009 172.27.129.248 111.202.114.27 TCP 54 26860  >  443 [ACK] Seq=359 Ack=2921 Win=132096 Len=0
304 1.962125 172.27.129.248 111.202.114.27 TCP 54 26853  >  443 [ACK] Seq=359 Ack=2921 Win=132096 Len=0
305 1.963208 172.27.129.248 111.202.114.27 TLSv1.2 180 Client Key Exchange  Change Cipher Spec  Encrypted Handshake Message
306 1.963728 111.202.114.27 172.27.129.248 TCP 1514 443  >  26854 [ACK] Seq=1461 Ack=359 Win=30464 Len=1460 [TCP segment of a reassembled PDU]
307 1.963728 111.202.114.27 172.27.129.248 TLSv1.2 1514 Server Hello
308 1.963729 111.202.114.27 172.27.129.248 TCP 1514 443  >  26861 [ACK] Seq=1461 Ack=359 Win=30464 Len=1460 [TCP segment of a reassembled PDU]
309 1.963729 111.202.114.27 172.27.129.248 TLSv1.2 435 Certificate  Server Key Exchange  Server Hello Done
310 1.963729 111.202.114.27 172.27.129.248 TLSv1.2 1514 Server Hello
311 1.963730 111.202.114.27 172.27.129.248 TLSv1.2 435 Certificate  Server Key Exchange  Server Hello Done
312 1.963730 111.202.114.27 172.27.129.248 TLSv1.2 1514 Server Hello
313 1.963730 111.202.114.27 172.27.129.248 TCP 1514 443  >  26857 [ACK] Seq=1461 Ack=359 Win=30464 Len=1460 [TCP segment of a reassembled PDU]
314 1.963731 111.202.114.27 172.27.129.248 TLSv1.2 435 Certificate  Server Key Exchange  Server Hello Done
315 1.963731 111.202.114.27 172.27.129.248 TCP 1514 443  >  26856 [ACK] Seq=1461 Ack=359 Win=30464 Len=1460 [TCP segment of a reassembled PDU]
316 1.963731 111.202.114.27 172.27.129.248 TLSv1.2 435 Certificate  Server Key Exchange  Server Hello Done
317 1.963811 172.27.129.248 111.202.114.27 TCP 54 26854  >  443 [ACK] Seq=359 Ack=2921 Win=132096 Len=0
318 1.963860 172.27.129.248 111.202.114.27 TCP 54 26861  >  443 [ACK] Seq=359 Ack=2921 Win=132096 Len=0
319 1.963951 172.27.129.248 111.202.114.27 TCP 54 26857  >  443 [ACK] Seq=359 Ack=2921 Win=132096 Len=0
320 1.964010 172.27.129.248 111.202.114.27 TCP 54 26856  >  443 [ACK] Seq=359 Ack=2921 Win=132096 Len=0
321 1.964071 111.202.114.27 172.27.129.248 TLSv1.2 1514 Server Hello
322 1.964072 111.202.114.27 172.27.129.248 TCP 1514 443  >  26865 [ACK] Seq=1461 Ack=183 Win=30464 Len=1460 [TCP segment of a reassembled PDU]
323 1.964072 111.202.114.27 172.27.129.248 TLSv1.2 435 Certificate  Server Key Exchange  Server Hello Done
324 1.964073 111.202.114.27 172.27.129.248 TLSv1.2 1514 Server Hello
325 1.964167 172.27.129.248 111.202.114.27 TCP 54 26865  >  443 [ACK] Seq=183 Ack=2921 Win=132096 Len=0
326 1.964179 172.27.129.248 111.202.114.27 TLSv1.2 180 Client Key Exchange  Change Cipher Spec  Encrypted Handshake Message
327 1.964276 111.202.114.27 172.27.129.248 TCP 1514 443  >  26849 [ACK] Seq=1461 Ack=359 Win=30464 Len=1460 [TCP segment of a reassembled PDU]
328 1.964276 111.202.114.27 172.27.129.248 TLSv1.2 435 Certificate  Server Key Exchange  Server Hello Done
329 1.964277 111.202.114.27 172.27.129.248 TCP 435 [TCP Spurious Retransmission] 443  >  26859 [PSH  ACK] Seq=2921 Ack=359 Win=30464 Len=381[Reassembly error  protocol TCP: New fragment overlaps old data (retransmission?)]
330 1.964310 172.27.129.248 111.202.114.27 TCP 54 26849  >  443 [ACK] Seq=359 Ack=2921 Win=132096 Len=0
331 1.964346 172.27.129.248 111.202.114.27 TCP 66 [TCP Dup ACK 248#1] 26859  >  443 [ACK] Seq=485 Ack=3302 Win=131584 Len=0 SLE=2921 SRE=3302
332 1.965160 172.27.129.248 111.202.114.27 TLSv1.2 180 Client Key Exchange  Change Cipher Spec  Encrypted Handshake Message
333 1.965471 111.202.114.27 172.27.129.248 TLSv1.2 1514 Server Hello
334 1.965472 111.202.114.27 172.27.129.248 TCP 1514 443  >  26850 [ACK] Seq=1461 Ack=359 Win=30464 Len=1460 [TCP segment of a reassembled PDU]
335 1.965473 111.202.114.27 172.27.129.248 TLSv1.2 435 Certificate  Server Key Exchange  Server Hello Done
336 1.965473 111.202.114.27 172.27.129.248 TCP 435 [TCP Spurious Retransmission] 443  >  26858 [PSH  ACK] Seq=2921 Ack=359 Win=30464 Len=381[Reassembly error  protocol TCP: New fragment overlaps old data (retransmission?)]
337 1.965473 111.202.114.27 172.27.129.248 TCP 435 [TCP Spurious Retransmission] 443  >  26851 [PSH  ACK] Seq=2921 Ack=359 Win=30464 Len=381[Reassembly error  protocol TCP: New fragment overlaps old data (retransmission?)]
338 1.965473 111.202.114.27 172.27.129.248 TCP 435 [TCP Spurious Retransmission] 443  >  26848 [PSH  ACK] Seq=2921 Ack=359 Win=30464 Len=381[Reassembly error  protocol TCP: New fragment overlaps old data (retransmission?)]
339 1.965547 172.27.129.248 111.202.114.27 TCP 54 26850  >  443 [ACK] Seq=359 Ack=2921 Win=132096 Len=0
340 1.965600 172.27.129.248 111.202.114.27 TCP 66 [TCP Dup ACK 243#1] 26858  >  443 [ACK] Seq=485 Ack=3302 Win=131584 Len=0 SLE=2921 SRE=3302
341 1.965652 172.27.129.248 111.202.114.27 TCP 66 [TCP Dup ACK 273#1] 26851  >  443 [ACK] Seq=485 Ack=3302 Win=131584 Len=0 SLE=2921 SRE=3302
342 1.965679 172.27.129.248 111.202.114.27 TCP 66 [TCP Dup ACK 257#1] 26848  >  443 [ACK] Seq=485 Ack=3302 Win=131584 Len=0 SLE=2921 SRE=3302
343 1.966139 172.27.129.248 111.202.114.27 TLSv1.2 180 Client Key Exchange  Change Cipher Spec  Encrypted Handshake Message
344 1.967128 172.27.129.248 111.202.114.27 TLSv1.2 180 Client Key Exchange  Change Cipher Spec  Encrypted Handshake Message
345 1.968007 111.202.114.27 172.27.129.248 TCP 435 [TCP Spurious Retransmission] 443  >  26863 [PSH  ACK] Seq=2921 Ack=183 Win=30464 Len=381[Reassembly error  protocol TCP: New fragment overlaps old data (retransmission?)]
346 1.968008 111.202.114.27 172.27.129.248 TCP 435 [TCP Spurious Retransmission] 443  >  26852 [PSH  ACK] Seq=2921 Ack=359 Win=30464 Len=381[Reassembly error  protocol TCP: New fragment overlaps old data (retransmission?)]
347 1.968008 111.202.114.27 172.27.129.248 TCP 435 [TCP Spurious Retransmission] 443  >  26855 [PSH  ACK] Seq=2921 Ack=359 Win=30464 Len=381[Reassembly error  protocol TCP: New fragment overlaps old data (retransmission?)]
348 1.968075 172.27.129.248 111.202.114.27 TCP 66 [TCP Dup ACK 326#1] 26863  >  443 [ACK] Seq=309 Ack=3302 Win=131584 Len=0 SLE=2921 SRE=3302
349 1.968125 172.27.129.248 111.202.114.27 TCP 66 [TCP Dup ACK 279#1] 26852  >  443 [ACK] Seq=485 Ack=3302 Win=131584 Len=0 SLE=2921 SRE=3302
350 1.968138 172.27.129.248 111.202.114.27 TLSv1.2 180 Client Key Exchange  Change Cipher Spec  Encrypted Handshake Message
351 1.968186 172.27.129.248 111.202.114.27 TCP 66 [TCP Dup ACK 302#1] 26855  >  443 [ACK] Seq=485 Ack=3302 Win=131584 Len=0 SLE=2921 SRE=3302
352 1.968915 111.202.114.27 172.27.129.248 TCP 435 [TCP Spurious Retransmission] 443  >  26862 [PSH  ACK] Seq=2921 Ack=183 Win=30464 Len=381[Reassembly error  protocol TCP: New fragment overlaps old data (retransmission?)]
353 1.968916 111.202.114.27 172.27.129.248 TCP 435 [TCP Spurious Retransmission] 443  >  26864 [PSH  ACK] Seq=2921 Ack=183 Win=30464 Len=381[Reassembly error  protocol TCP: New fragment overlaps old data (retransmission?)]
354 1.968972 172.27.129.248 111.202.114.27 TCP 66 [TCP Dup ACK 305#1] 26862  >  443 [ACK] Seq=309 Ack=3302 Win=131584 Len=0 SLE=2921 SRE=3302
355 1.969009 172.27.129.248 111.202.114.27 TCP 66 [TCP Dup ACK 332#1] 26864  >  443 [ACK] Seq=309 Ack=3302 Win=131584 Len=0 SLE=2921 SRE=3302
356 1.969126 172.27.129.248 111.202.114.27 TLSv1.2 180 Client Key Exchange  Change Cipher Spec  Encrypted Handshake Message
357 1.970119 172.27.129.248 111.202.114.27 TLSv1.2 180 Client Key Exchange  Change Cipher Spec  Encrypted Handshake Message
358 1.970224 111.202.114.27 172.27.129.248 TCP 435 [TCP Spurious Retransmission] 443  >  26866 [PSH  ACK] Seq=2921 Ack=183 Win=30464 Len=381[Reassembly error  protocol TCP: New fragment overlaps old data (retransmission?)]
359 1.970225 111.202.114.27 172.27.129.248 TCP 435 [TCP Retransmission] 443  >  26860 [PSH  ACK] Seq=2921 Ack=359 Win=30464 Len=381
360 1.970291 172.27.129.248 111.202.114.27 TCP 66 [TCP Dup ACK 344#1] 26866  >  443 [ACK] Seq=309 Ack=3302 Win=131584 Len=0 SLE=2921 SRE=3302
361 1.970332 172.27.129.248 111.202.114.27 TCP 66 26860  >  443 [ACK] Seq=359 Ack=3302 Win=131584 Len=0 SLE=2921 SRE=3302
362 1.971116 172.27.129.248 111.202.114.27 TLSv1.2 180 Client Key Exchange  Change Cipher Spec  Encrypted Handshake Message
363 1.971416 111.202.114.27 172.27.129.248 TCP 435 [TCP Spurious Retransmission] 443  >  26854 [PSH  ACK] Seq=2921 Ack=359 Win=30464 Len=381[Reassembly error  protocol TCP: New fragment overlaps old data (retransmission?)]
364 1.971417 111.202.114.27 172.27.129.248 TCP 435 [TCP Retransmission] 443  >  26861 [PSH  ACK] Seq=2921 Ack=359 Win=30464 Len=381
365 1.971485 172.27.129.248 111.202.114.27 TCP 66 [TCP Dup ACK 362#1] 26854  >  443 [ACK] Seq=485 Ack=3302 Win=131584 Len=0 SLE=2921 SRE=3302
366 1.971514 172.27.129.248 111.202.114.27 TCP 66 26861  >  443 [ACK] Seq=359 Ack=3302 Win=131584 Len=0 SLE=2921 SRE=3302
367 1.972114 172.27.129.248 111.202.114.27 TLSv1.2 180 Client Key Exchange  Change Cipher Spec  Encrypted Handshake Message
368 1.973133 172.27.129.248 111.202.114.27 TLSv1.2 180 Client Key Exchange  Change Cipher Spec  Encrypted Handshake Message
369 1.974132 172.27.129.248 111.202.114.27 TLSv1.2 180 Client Key Exchange  Change Cipher Spec  Encrypted Handshake Message
370 1.975100 172.27.129.248 111.202.114.27 TLSv1.2 180 Client Key Exchange  Change Cipher Spec  Encrypted Handshake Message
371 2.028778 111.202.114.27 172.27.129.248 TCP 435 [TCP Spurious Retransmission] 443  >  26857 [PSH  ACK] Seq=2921 Ack=359 Win=30464 Len=381[Reassembly error  protocol TCP: New fragment overlaps old data (retransmission?)]
